{
  "schema_version": "electrodeposition/1.0",
  "experiment_type": "electrodeposition",

  "page":           { "value": 57,    "confidence": 0.99, "provenance": "ocr_text", "bbox": [120, 150, 90, 40] },
  "continued_from": { "value": 56,    "confidence": 0.95, "provenance": "ocr_text", "bbox": [1480, 60, 120, 60] },
  "date":           { "value": "June 4", "confidence": 0.97, "provenance": "ocr_text", "bbox": [110, 290, 130, 40] },
  "project":        { "value": "Li electrodeposition - glyme electrolytes", "confidence": 0.94, "provenance": "ocr_text", "bbox": [330, 165, 900, 45] },
  "goal":           { "value": "Screen electrolyte 240604-B for stable Li plating at 30 C", "confidence": 0.9, "provenance": "ocr_text", "bbox": [360, 305, 1000, 90] },

  "electrolyte": {
    "salt":          { "value": "LiTFSI", "confidence": 0.93, "provenance": "ocr_text", "bbox": [560, 430, 160, 45] },
    "concentration": { "value": 1.0, "unit": "M", "confidence": 0.92, "provenance": "ocr_text", "bbox": [470, 430, 60, 45], "raw": "1M" },
    "solvent":       { "value": "diglyme:EtOH", "confidence": 0.88, "provenance": "ocr_text", "bbox": [820, 425, 280, 50] },
    "solvent_ratio": { "value": "4:1 v/v", "confidence": 0.9, "provenance": "ocr_text", "bbox": [1130, 425, 150, 50] },
    "volume":        { "value": 20, "unit": "mL", "confidence": 0.95, "provenance": "ocr_text", "bbox": [1180, 490, 120, 45], "raw": "20 mL tot" },
    "additive": {
      "name":   { "value": "12-crown-4", "confidence": 0.91, "provenance": "ocr_text", "bbox": [560, 560, 230, 45] },
      "amount": { "value": 5, "unit": "mol%", "confidence": 0.85, "provenance": "normalize", "bbox": [430, 560, 110, 45], "raw": "8% [struck] 5 mol%" }
    }
  },

  "conditions": {
    "temperature":   { "value": 22.4, "unit": "C", "confidence": 0.96, "provenance": "normalize", "bbox": [420, 630, 120, 45], "raw": "22.4C" },
    "atmosphere":    { "value": "glovebox", "confidence": 0.9, "provenance": "ocr_text", "bbox": [640, 630, 200, 45] },
    "water_content": { "value": "< 1 ppm", "confidence": 0.88, "provenance": "ocr_text", "bbox": [850, 630, 180, 45], "raw": "H2O < 1 ppm" }
  },

  "cell": {
    "working_electrode":   { "value": "glassy C RDE", "confidence": 0.87, "provenance": "ocr_text", "bbox": [560, 690, 320, 45] },
    "counter_electrode":   { "value": "Li foil", "confidence": 0.93, "provenance": "ocr_text", "bbox": [1150, 690, 170, 45] },
    "reference_electrode": { "value": "Ag/AgCl", "confidence": 0.95, "provenance": "ocr_text", "bbox": [300, 740, 180, 45] }
  },

  "runs": [
    {
      "id":              { "value": "240604-B1", "confidence": 0.94, "provenance": "ocr_text", "bbox": [620, 880, 220, 45] },
      "potential":       { "value": -0.45, "unit": "V", "confidence": 0.92, "provenance": "ocr_math", "bbox": [430, 945, 120, 45], "raw": "-0.45V" },
      "reference":       { "value": "Ag/AgCl", "confidence": 0.95, "provenance": "ocr_text", "bbox": [640, 945, 180, 45] },
      "duration":        { "value": 90, "unit": "min", "confidence": 0.97, "provenance": "ocr_math", "bbox": [930, 945, 120, 45] },
      "rotation_rate":   { "value": 1600, "unit": "rpm", "confidence": 0.96, "provenance": "ocr_math", "bbox": [1180, 945, 160, 45], "raw": "w = 1600 rpm" },
      "current_density": { "value": 0.50, "unit": "mA/cm^2", "confidence": 0.93, "provenance": "ocr_math", "bbox": [430, 1010, 200, 45] },
      "electrode_area":  { "value": 0.3, "unit": "cm^2", "confidence": 0.95, "provenance": "ocr_math", "bbox": [780, 1010, 140, 45] }
    }
  ],

  "calculations": {
    "current":         { "value": 1.5e-4, "unit": "A", "confidence": 0.9, "provenance": "ocr_math", "bbox": [820, 1075, 180, 45], "raw": "1.5E-4 A" },
    "charge":          { "value": 0.81, "unit": "C", "confidence": 0.91, "provenance": "ocr_math", "bbox": [900, 1230, 160, 45] },
    "moles_deposited": { "value": 8.4e-6, "unit": "mol", "confidence": 0.88, "provenance": "ocr_math", "bbox": [1080, 1300, 200, 45], "raw": "8.4 E-6 mol" },
    "mass_deposited":  { "value": 5.8e-5, "unit": "g", "confidence": 0.85, "provenance": "ocr_math", "bbox": [1560, 1300, 160, 45], "raw": "5.8E-5 g" },
    "self_consistency": {
      "all_passed": true,
      "checks": [
        { "name": "I",    "derived": 0.00015,   "extracted": 0.00015, "unit": "A",   "rel_error": 0.0,     "ok": true },
        { "name": "t",    "derived": 5400,      "extracted": 5400,    "unit": "s",   "rel_error": 0.0,     "ok": true },
        { "name": "Q",    "derived": 0.81,      "extracted": 0.81,    "unit": "C",   "rel_error": 0.0,     "ok": true },
        { "name": "n",    "derived": 8.395e-06, "extracted": 8.4e-06, "unit": "mol", "rel_error": 0.0006,  "ok": true },
        { "name": "mass", "derived": 5.826e-05, "extracted": 5.8e-05, "unit": "g",   "rel_error": 0.0045,  "ok": true }
      ]
    }
  },

  "structures": [
    {
      "label":       { "value": "[Li(12-crown-4)]+", "confidence": 0.82, "provenance": "ocr_text", "bbox": [300, 1680, 360, 50] },
      "smiles":      "[Li+].C1COCCOCCOCCO1",
      "formula":     "C8H16LiO4",
      "source":      "label_resolution",
      "rdkit_valid": true,
      "confidence":  0.9,
      "bbox":        [300, 1480, 560, 320]
    },
    {
      "label":       { "value": "LiTFSI", "confidence": 0.93, "provenance": "ocr_text", "bbox": [1300, 1790, 200, 50] },
      "smiles":      "[Li+].[N-](S(=O)(=O)C(F)(F)F)S(=O)(=O)C(F)(F)F",
      "formula":     "C2F6LiNO4S2",
      "source":      "label_resolution",
      "rdkit_valid": true,
      "confidence":  0.92,
      "bbox":        [1100, 1560, 600, 280]
    },
    {
      "label":       { "value": "diglyme", "confidence": 0.85, "provenance": "ocr_text", "bbox": [1180, 430, 200, 45] },
      "smiles":      "COCCOCCOC",
      "formula":     "C6H14O3",
      "source":      "label_resolution",
      "rdkit_valid": true,
      "confidence":  0.88,
      "bbox":        [1280, 380, 240, 90]
    }
  ],

  "results": {
    "film_observation": { "value": "grey, dull", "confidence": 0.86, "provenance": "ocr_text", "bbox": [1560, 1990, 280, 45] },
    "xrd": [
      { "two_theta": { "value": 2.1, "unit": "deg", "confidence": 0.84, "provenance": "ocr_math", "bbox": [1560, 2050, 160, 45], "raw": "2theta = 2.1" },
        "note":      { "value": "main peak, low intensity", "confidence": 0.8, "provenance": "ocr_text", "bbox": [1560, 2095, 300, 45] } },
      { "two_theta": { "value": 4.7, "unit": "deg", "confidence": 0.83, "provenance": "ocr_math", "bbox": [1560, 2160, 160, 45], "raw": "2theta = 4.7" },
        "note":      { "value": "shoulder", "confidence": 0.85, "provenance": "ocr_text", "bbox": [1560, 2160, 150, 45] } }
    ],
    "temperature_series": [
      { "time": { "value": 0,  "unit": "min", "confidence": 0.97, "provenance": "ocr_text", "bbox": [360, 1990, 90, 40] }, "temperature": { "value": 22.4, "unit": "C", "confidence": 0.96, "provenance": "normalize", "bbox": [560, 1990, 110, 40] } },
      { "time": { "value": 1,  "unit": "min", "confidence": 0.97, "provenance": "ocr_text", "bbox": [360, 2050, 90, 40] }, "temperature": { "value": 23.1, "unit": "C", "confidence": 0.95, "provenance": "normalize", "bbox": [560, 2050, 110, 40] } },
      { "time": { "value": 5,  "unit": "min", "confidence": 0.97, "provenance": "ocr_text", "bbox": [360, 2110, 90, 40] }, "temperature": { "value": 25.6, "unit": "C", "confidence": 0.95, "provenance": "normalize", "bbox": [560, 2110, 110, 40] } },
      { "time": { "value": 10, "unit": "min", "confidence": 0.97, "provenance": "ocr_text", "bbox": [360, 2170, 90, 40] }, "temperature": { "value": 27.9, "unit": "C", "confidence": 0.95, "provenance": "normalize", "bbox": [560, 2170, 110, 40] } },
      { "time": { "value": 20, "unit": "min", "confidence": 0.97, "provenance": "ocr_text", "bbox": [900, 1990, 90, 40] }, "temperature": { "value": 30.1, "unit": "C", "confidence": 0.95, "provenance": "normalize", "bbox": [1100, 1990, 110, 40] } },
      { "time": { "value": 40, "unit": "min", "confidence": 0.97, "provenance": "ocr_text", "bbox": [900, 2050, 90, 40] }, "temperature": { "value": 31.5, "unit": "C", "confidence": 0.95, "provenance": "normalize", "bbox": [1100, 2050, 110, 40] } },
      { "time": { "value": 60, "unit": "min", "confidence": 0.96, "provenance": "ocr_text", "bbox": [900, 2110, 90, 40], "raw": "1 hr" }, "temperature": { "value": 32.0, "unit": "C", "confidence": 0.95, "provenance": "normalize", "bbox": [1100, 2110, 110, 40] } },
      { "time": { "value": 90, "unit": "min", "confidence": 0.95, "provenance": "ocr_text", "bbox": [900, 2170, 90, 40], "raw": "1 hr 30 min" }, "temperature": { "value": 32.6, "unit": "C", "confidence": 0.95, "provenance": "normalize", "bbox": [1100, 2170, 110, 40] } }
    ]
  }
}
